{"schemaVersion":2,"id":"editor-attack","kind":"attack","commands":[{"type":"fire","parameters":{"weaponId":"editor-shot"},"repeatCount":1,"maximumSpawnCount":3,"difficultyTags":[]},{"type":"wait","parameters":{"duration":0.25},"repeatCount":1,"maximumSpawnCount":0,"difficultyTags":[]},{"type":"repeat","parameters":{},"patternId":"editor-attack-cycle","repeatCount":8,"maximumSpawnCount":0,"difficultyTags":[]}]}
