{"schemaVersion":2,"id":"attack-cycle-11","kind":"attack","commands":[{"type":"fire","parameters":{"weaponId":"enemy-pattern-11"},"repeatCount":1,"maximumSpawnCount":10,"difficultyTags":[]},{"type":"wait","parameters":{"duration":0.8500000000000001},"repeatCount":1,"maximumSpawnCount":0,"difficultyTags":[]}]}
